{
  "name": "Hitesh Shetty",
  "title": "Senior Software Engineer",
  "tagline": "Always learning, always building.",
  "location": "Mumbai, India",
  "bio": "Full-stack engineer passionate about React, TypeScript, and Node.js. Iâ€™ve worked on flagship visual editing platforms, AI integrations, and scalable backend services, and I love contributing to open source (Slate.js, Stylex, npm packages). Always learning, always building.",
  "description": "I build fast, intuitive products that scale. Senior Full-Stack Engineer using React, TypeScript, and Node.js to build scalable, high-performance apps, from visual editors to AI-powered features.",
  "email": "hitesh.shetty2011@gmail.com",
  "linkedin": "https://linkedin.com/in/hiteshshetty-dev",
  "github": "https://github.com/hiteshshetty-dev",
  "medium": "https://medium.com/@hitesh.shetty2011",
  "codepen": "https://codepen.io/hiteshshetty-dev",
  "leetcode": "https://leetcode.com/u/hiteshshetty-dev",
  "x": "https://x.com/hiteshshettydev"
}
